[
  {"id":"search","name":"Search","predecessors":[],"work":"10,000 concurrent agents; 88 hours; 2.7 million messages; ~130 billion output tokens (source-reported in note)","state_exported":"candidate insights and intermediate search state; exact artifact not yet retrieved","verification_burden":"triage, synthesis, and independent reconstruction","trust_assumptions":["source note accurately reports the search process","agent outputs are available and attributable"],"evidence_ids":["e-search-scale"]},
  {"id":"candidate-insight","name":"Candidate insight","predecessors":["search"],"work":"selection and cross-pollination work; quantity not independently measured","state_exported":"candidate mathematical route or lemma","verification_burden":"test route against stated problem and counterexamples","trust_assumptions":["selection did not discard decisive negative evidence"],"evidence_ids":[]},
  {"id":"proof-construction","name":"Proof construction","predecessors":["candidate-insight"],"work":"166-page mathematical construction (source-reported in note)","state_exported":"structured proof text, residual/correction interfaces, and assumptions","verification_burden":"human mathematical review and dependency tracing","trust_assumptions":["definitions and boundary conditions are faithfully transcribed"],"evidence_ids":["e-proof-length"]},
  {"id":"formalization","name":"Formalization","predecessors":["proof-construction"],"work":"17 hours reported for Lean formalization/verification phase in note","state_exported":"machine-checkable formal proof object","verification_burden":"elaboration and independent environment replay","trust_assumptions":["Lean version, libraries, and imported axioms are identified"],"evidence_ids":["e-formalization-time"]},
  {"id":"kernel-verification","name":"Kernel verification","predecessors":["formalization"],"work":"deterministic checking work; runtime not available in source note","state_exported":"kernel verdict and reproducibility metadata","verification_burden":"kernel execution plus environment/provenance audit","trust_assumptions":["kernel and trusted base are correctly identified"],"evidence_ids":[]},
  {"id":"reuse","name":"Reuse","predecessors":["kernel-verification"],"work":"future checking and downstream use; not yet measured","state_exported":"versioned theorem/proof artifact and verifier recipe","verification_burden":"compatibility, freshness, and re-verification under changed dependencies","trust_assumptions":["artifact remains available and its dependencies remain auditable"],"evidence_ids":[]}
]
